<?xml version="1.0" encoding="UTF-8"?>
<!DOCTYPE assessment SYSTEM "assessment.dtd">
<assessment>
  <id>660e8400-e29b-41d4-a716-446655440001</id>
  <patient_id>550e8400-e29b-41d4-a716-446655440000</patient_id>
  <status>draft</status>
  <created_at>2026-04-09T10:00:00Z</created_at>
  <updated_at>2026-04-09T10:00:00Z</updated_at>
  <acknowledgment>
    <id>880e8400-e29b-41d4-a716-446655440003</id>
    <assessment_id>660e8400-e29b-41d4-a716-446655440001</assessment_id>
    <agreed>true</agreed>
    <patient_typed_full_name>Example</patient_typed_full_name>
    <patient_typed_date>2026-01-15</patient_typed_date>
    <acknowledged_at>2026-04-09T10:00:00Z</acknowledged_at>
    <created_at>2026-04-09T10:00:00Z</created_at>
    <updated_at>2026-04-09T10:00:00Z</updated_at>
  </acknowledgment>
  <practice_configuration>
    <id>770e8400-e29b-41d4-a716-446655440002</id>
    <assessment_id>660e8400-e29b-41d4-a716-446655440001</assessment_id>
    <practice_name>Example</practice_name>
    <practice_address/>
    <dpo_name>Example</dpo_name>
    <dpo_contact_details>Example text.</dpo_contact_details>
    <research_organisations/>
    <data_sharing_partners/>
    <created_at>2026-04-09T10:00:00Z</created_at>
    <updated_at>2026-04-09T10:00:00Z</updated_at>
  </practice_configuration>
</assessment>
